{
  "counts": {
    "designated_attempts": 40000,
    "destination_transactions": 40000,
    "intermediate_transactions": 40000,
    "physical_transactions": 120000,
    "source_transactions": 40000,
    "xir_transitions": 20000
  },
  "eligible": true,
  "environment": "controlled-local-qbft",
  "plan_sha256": "99cfdfd760d1a7a1189d584be40c193567c9b6ca3b5d9d9935ebd679f5b75948",
  "profile_sha256": "3392015a6fd18f89f0a88f38133bd9078ceb82d96f3495d0f9210cdf662076fe",
  "progression": {
    "measured_limits_sha256": "9fdcc5e90a4353b36d409d891e4fc9db39a20e86edc0c53fd6dce18fe5cbb374",
    "rehearsal_freeze_sha256": "9df60c19f782c598cd14a3ac3317955a4a3316342ffde106574b9b5d79e3cef1",
    "smoke_freeze_sha256": "6d7cfd2a965e166a74e06c9986fb2a36b1492e6107c2e777f5e54115c334d7f4"
  },
  "reason_codes": [],
  "route_counts": {
    "HH": 10000,
    "HL": 10000,
    "LH": 10000,
    "LL": 10000
  },
  "route_semantics": {
    "HH": {
      "execution_class": "homogeneous-native",
      "first_carrier": "hyperlane",
      "second_carrier": "hyperlane",
      "xir": false
    },
    "HL": {
      "execution_class": "heterogeneous-xir",
      "first_carrier": "hyperlane",
      "second_carrier": "layerzero-v2",
      "xir": true
    },
    "LH": {
      "execution_class": "heterogeneous-xir",
      "first_carrier": "layerzero-v2",
      "second_carrier": "hyperlane",
      "xir": true
    },
    "LL": {
      "execution_class": "homogeneous-native",
      "first_carrier": "layerzero-v2",
      "second_carrier": "layerzero-v2",
      "xir": false
    }
  },
  "schema_version": "xir-lab-local-paper-scale-plan-v2",
  "topology_sha256": "c18fcd7dab48a055063aff254d6ed82a827a6aef9942f18be93a5cafea737a3b"
}
